<Defs xmlns:xsi="http://www.w3.org/2001/XMLSchema-instance" xsi:noNamespaceSchemaLocation="../Schemas/TradeColumnDef.xsd">
	<DynamicTradeInterface.Defs.TradeColumnDef>
		<defName>colDurabilityDef</defName>
		<label>d</label>
		<tooltip>Durability</tooltip>
		<description>Shows the remaining hitpoints (if any) as a percentage.</description>
		<defaultWidth>40</defaultWidth>
		<defaultVisible>false</defaultVisible>
		<callbackHandler>DynamicTradeInterface.UserInterface.Columns.ColumnDurability:Draw</callbackHandler>
		<orderValueCallbackHandler>DynamicTradeInterface.UserInterface.Columns.ColumnDurability:OrderbyValue</orderValueCallbackHandler>
	</DynamicTradeInterface.Defs.TradeColumnDef>

	<DynamicTradeInterface.Defs.TradeColumnDef>
		<defName>colPricePerWeightDef</defName>
		<label>/kg</label>
		<tooltip>price / kg</tooltip>
		<description>Shows the price divided by mass.</description>
		<defaultWidth>50</defaultWidth>
		<defaultVisible>false</defaultVisible>
		<callbackHandler>DynamicTradeInterface.UserInterface.Columns.ColumnPricePerWeight:Draw</callbackHandler>
		<orderValueCallbackHandler>DynamicTradeInterface.UserInterface.Columns.ColumnPricePerWeight:OrderbyValue</orderValueCallbackHandler>
		<postOpenCallbackHandler>DynamicTradeInterface.UserInterface.Columns.ColumnPricePerWeight:PostOpen</postOpenCallbackHandler>
		<postClosedCallbackHandler>DynamicTradeInterface.UserInterface.Columns.ColumnPricePerWeight:PostClosed</postClosedCallbackHandler>
	</DynamicTradeInterface.Defs.TradeColumnDef>
</Defs>